query,ranked
Historia medieval de las ciudades europeas,"['Dortmund durante la Segunda Guerra Mundial', 'Museo del Fútbol Alemán', 'Madrid Río']"
Principales destinos turísticos en Europa,"['El Palacio Real', 'Historia de Madrid', 'Real Madrid y el Estadio Santiago Bernabéu']"
Influencia de la realeza en la cultura europea,"['Real Madrid y el Estadio Santiago Bernabéu', 'Gastronomía Madrileña', 'Museo del Prado']"
Importancia de los parques urbanos en las ciudades,"['La cervecería Dortmund', 'Parque del Retiro', 'Madrid Río']"
Gastronomía típica en capitales europeas,"['Historia de Madrid', 'Real Madrid y el Estadio Santiago Bernabéu', 'Nochevieja en Puerta del Sol']"
Eventos deportivos icónicos en Europa,"['El Palacio Real', 'Historia de Madrid', 'Real Madrid y el Estadio Santiago Bernabéu']"
Celebraciones de Navidad en ciudades europeas,"['Real Madrid y el Estadio Santiago Bernabéu', 'Gastronomía Madrileña', 'La cervecería Dortmund']"
Museos de arte importantes en Europa,"['Real Madrid y el Estadio Santiago Bernabéu', 'Gastronomía Madrileña', 'La cervecería Dortmund']"
Efectos de la Segunda Guerra Mundial en ciudades europeas,"['Real Madrid y el Estadio Santiago Bernabéu', 'Gastronomía Madrileña', 'Museo del Prado']"
Arquitectura histórica en ciudades europeas,"['Historia de Madrid', 'Real Madrid y el Estadio Santiago Bernabéu', 'Nochevieja en Puerta del Sol']"
Clubes de fútbol famosos y sus estadios en Europa,"['Gastronomía Madrileña', 'Nochevieja en Puerta del Sol', 'La cervecería Dortmund']"
Transformación urbana y regeneración de espacios,"['Museo del Fútbol Alemán', 'Gastronomía Madrileña', 'Historia de Dortmund']"
Tradición cervecera en ciudades europeas,"['Historia de Madrid', 'Real Madrid y el Estadio Santiago Bernabéu', 'Zoológico de Dortmund']"
Mercados y comercio tradicional en Europa,"['La cervecería Dortmund', 'Parque del Retiro', 'La Reinoldikirche']"
Centros de arte y creatividad en ciudades modernas,"['La cervecería Dortmund', 'Museo del Fútbol Alemán', 'Gastronomía Madrileña']"
Actividades de ocio y entretenimiento en ciudades metropolitanas,"['La cervecería Dortmund', 'Museo del Fútbol Alemán', 'Gastronomía Madrileña']"
Conservación de la naturaleza y la vida silvestre en zonas urbanas,"['Gastronomía Madrileña', 'Museo del Prado', 'Real Madrid y el Estadio Santiago Bernabéu']"
Planificación de eventos culturales y festivales en ciudades,"['La cervecería Dortmund', 'Museo del Fútbol Alemán', 'Gastronomía Madrileña']"
Desarrollo del transporte y la infraestructura urbana,"['Gastronomía Madrileña', 'Historia de Dortmund', 'Mercado de Navidad de Dortmund']"
Impacto de la tecnología en la vida urbana,"['Real Madrid y el Estadio Santiago Bernabéu', 'Gastronomía Madrileña', 'Museo del Prado']"
